mysql> select * from tbl_user;
Empty set (0.00 sec)

mysql> desc tbl_user;
+------------+--------------+------+-----+---------+-------+
| Field      | Type         | Null | Key | Default | Extra |
+------------+--------------+------+-----+---------+-------+
| user_id    | varchar(10)  | NO   | PRI | NULL    |       |
| user_name  | varchar(45)  | NO   |     | NULL    |       |
| user_phone | varchar(100) | NO   |     | NULL    |       |
+------------+--------------+------+-----+---------+-------+
3 rows in set (0.00 sec)

mysql> insert into test2db.tbl_user(user_id,user_name,user_phone)
    -> values('user10','홍길동','010-222-3333');
Query OK, 1 row affected (0.01 sec)

mysql> insert into test2db.tbl_user values('user20','남길동','010-555-6666');
Query OK, 1 row affected (0.00 sec)

mysql> select * from tbl_user;
+---------+-----------+--------------+
| user_id | user_name | user_phone   |
+---------+-----------+--------------+
| user10  | 홍길동    | 010-222-3333 |
| user20  | 남길동    | 010-555-6666 |
+---------+-----------+--------------+
2 rows in set (0.00 sec)

mysql> select user_id,user_name from tbl_user;
+---------+-----------+
| user_id | user_name |
+---------+-----------+
| user10  | 홍길동    |
| user20  | 남길동    |
+---------+-----------+
2 rows in set (0.00 sec)

mysql> select * from tbl_user;
+---------+-----------+--------------+
| user_id | user_name | user_phone   |
+---------+-----------+--------------+
| user10  | 홍길동    | 010-222-3333 |
| user20  | 남길동    | 010-555-6666 |
+---------+-----------+--------------+
2 rows in set (0.00 sec)

mysql> update tbl_user set user_name='철수' where user_id='user20';
Query OK, 1 row affected (0.00 sec)
Rows matched: 1  Changed: 1  Warnings: 0

mysql> select * from tbl_user;
+---------+-----------+--------------+
| user_id | user_name | user_phone   |
+---------+-----------+--------------+
| user10  | 홍길동    | 010-222-3333 |
| user20  | 철수      | 010-555-6666 |
+---------+-----------+--------------+
2 rows in set (0.00 sec)

mysql> delete from tbl_user where user_id='user10';
Query OK, 1 row affected (0.00 sec)

mysql> select * from tbl_user;
+---------+-----------+--------------+
| user_id | user_name | user_phone   |
+---------+-----------+--------------+
| user20  | 철수      | 010-555-6666 |
+---------+-----------+--------------+
1 row in set (0.00 sec)

mysql>
